{
  "$schema": "http://json-schema.org/draft-07/schema#",
  "title": "Log",
  "type": "object",
  "properties": {
    "ts": {
      "type": "string",
      "format": "date-time",
      "description": "ISO 8601 UTC"
    },
    "service": {
      "type": "string"
    },
    "level": {
      "type": "string",
      "enum": [
        "DEBUG",
        "INFO",
        "WARN",
        "ERROR"
      ]
    },
    "message": {
      "type": "string"
    },
    "trace_id": {
      "type": [
        "string",
        "null"
      ]
    }
  },
  "required": [
    "ts",
    "service",
    "level",
    "message"
  ]
}
